{
  "pair": [
    "CG-05",
    "RE-10"
  ],
  "type": "sequence-amplifying",
  "fact": "An opened curiosity gap that is closed with genuinely useful information delivers value before anything is asked — which is the precondition for reciprocity. The sequence matters: the gap creates attention, the resolution creates the gift, and only then does an ask land on an obligation. The same sequence with a hollow resolution inverts it — an unmet gap is experienced as a taking rather than a giving, and generates reactance instead of obligation.",
  "grade": "C",
  "boundary": "Inference; no direct study of the pair. Depends entirely on the resolution being independently valuable — the reciprocity component is carried by the value delivered, not by the curiosity. Clickbait is the failure case of this exact pairing.",
  "source": "Loewenstein 1994 doi:10.1037/0033-2909.116.1.75; Gouldner 1960 doi:10.2307/2092623 (norm of reciprocity). Interaction claim is inferred convergence."
}
