{
  "pair": [
    "ID-12",
    "VR-02"
  ],
  "type": "reinforcing",
  "fact": "Rewards that confirm a self-image the user has declared are processed differently from generic rewards: identity-based motivation holds that people act in line with salient identities, so an unpredictable reward that reads as evidence of being the kind of person they said they are ('you're building something') carries motivational weight beyond its face value. Rewards inconsistent with the declared identity are discounted or ignored.",
  "grade": "C+",
  "boundary": "Inference from identity-based motivation applied to reward structure, not a studied pair. Requires a genuinely self-chosen identity or goal — an imposed label does not confer the effect and can produce resistance. Effect is weak where the identity is peripheral to the user's self-concept.",
  "source": "Oyserman 2009 doi:10.1086/651257 (identity-based motivation); Schultz Dayan & Montague 1997 doi:10.1126/science.275.5306.1593. Interaction claim is inferred."
}
