{
  "pair": [
    "VR-02",
    "ZE-07"
  ],
  "type": "reinforcing",
  "fact": "Uncertainty about the size or nature of a reward can motivate goal pursuit more than a certain reward of equal or greater expected value — the motivating-uncertainty effect — but only while the person is actively engaged in pursuit rather than deliberating whether to start. Within a progress structure, variable rewards along the path sustain effort; at the decision to begin, uncertainty suppresses.",
  "grade": "B",
  "boundary": "Directional reversal is the key constraint: uncertain rewards demotivate at the deliberation stage and motivate during pursuit. Effect also depends on the uncertainty being resolvable and the pursuit being ongoing; open-ended uncertainty with no resolution point produces fatigue rather than drive.",
  "source": "Shen, Fishbach & Hsee 2015, The Motivating-Uncertainty Effect, J Consumer Research doi:10.1086/679418 (directly studied); goal-gradient: Kivetz et al. 2006 doi:10.1509/jmkr.43.1.39."
}
