{
  "pair": [
    "CG-05",
    "SP-08"
  ],
  "type": "reinforcing",
  "fact": "Social signals act as curiosity triggers as well as evidence: knowing that many others found something worthwhile creates a gap about what they found. The social cue both certifies that the answer is worth having and marks that one does not yet have it — the two mechanisms load the same cue from different directions.",
  "grade": "C+",
  "boundary": "Inferred convergence, not a studied interaction. Shares a failure mode with any social cue: if the popularity signal is not credible, both the evidential and the curiosity value collapse together. Weak where the user has a formed opinion of the topic — no gap remains to open.",
  "source": "Loewenstein 1994 doi:10.1037/0033-2909.116.1.75; Cialdini Reno & Kallgren 1990 doi:10.1037/0022-3514.58.6.1015. Interaction claim is inferred."
}
