{
  "pair": [
    "FR-11",
    "RE-10"
  ],
  "type": "reinforcing",
  "fact": "Whether something free is experienced as a gift or as a transaction is a framing decision, and it determines whether reciprocity engages at all. The same object presented as an unconditional gift generates reciprocal response; presented as a sample with an expected return, it is processed as the opening of a negotiation and the obligation weakens. Reciprocity is thus gated by framing rather than by the value transferred.",
  "grade": "C+",
  "boundary": "Inferred from the gift-exchange and framing literatures rather than a direct test of the pair. Transparent quid-pro-quo framing does not merely weaken the effect — it can trigger reactance. The gift must also be genuinely useful; framing cannot rescue a hollow offering.",
  "source": "Gouldner 1960 doi:10.2307/2092623; Tversky & Kahneman 1981 doi:10.1126/science.7455683; gift-exchange field literature. Interaction claim is inferred."
}
