{
  "pair": [
    "CG-05",
    "FR-11"
  ],
  "type": "reinforcing",
  "fact": "Curiosity depends on the reference point the question is framed against. In information-gap theory the drive scales with awareness of what one does not know: a gap framed too broadly reads as unanswerable and produces no pull, one framed as trivially known produces none either. Curiosity is highest at intermediate perceived knowledge — which makes the framing of the question, not the question itself, the operative variable.",
  "grade": "C+",
  "boundary": "Inferred from Loewenstein's account of gap salience rather than from a study of the two mechanisms combined. The inverted-U over perceived knowledge is theory-supported but its precise shape in applied contexts is not well established; framing that misrepresents what will be revealed collapses the effect and damages trust.",
  "source": "Loewenstein 1994 doi:10.1037/0033-2909.116.1.75 (information-gap theory, gap salience); Tversky & Kahneman 1981 doi:10.1126/science.7455683 (framing). Interaction claim is inferred."
}
