{
  "pair": [
    "EN-03",
    "ZE-07"
  ],
  "type": "sequence-amplifying",
  "fact": "Progress itself becomes owned. The endowed-progress effect is the studied case of exactly this intersection: participants given artificial advancement toward a goal (a card pre-stamped with bonus stamps, same net requirement) completed faster than those starting from zero — the granted progress is treated as a possession worth continuing rather than an empty start. Accumulated progress therefore functions as endowment, which is why abandoning a partially-complete goal feels like giving something up rather than merely stopping.",
  "grade": "B+",
  "boundary": "The head-start must correspond to something real or credibly attributed; participants who perceive the advancement as arbitrary padding show weaker effects. Applies to goals with visible, countable progress — diffuse or unmeasurable goals do not accumulate ownable progress.",
  "source": "Nunes & Dreze 2006 doi:10.1086/500480 (endowed progress effect — the directly studied intersection); Kivetz Urminsky & Zheng 2006 doi:10.1509/jmkr.43.1.39; endowment: KKT 1990 doi:10.1086/261737."
}
