{
  "pair": [
    "EN-03",
    "VR-02"
  ],
  "type": "reinforcing",
  "fact": "When a variable reward produces something the user keeps — a generated artifact, unlocked state, saved result — the reward stops being a momentary hit and becomes accumulated property. The unpredictable delivery drives the return, the retained output builds the endowment that makes leaving costly. Reward systems that leave nothing behind decay when novelty fades; ones that deposit ownable state compound.",
  "grade": "C+",
  "boundary": "Inference from the convergence of two literatures, not a directly studied interaction — graded accordingly. Requires the variable output to be genuinely retained and personally attributable; a reward the user cannot keep, see, or claim as theirs produces no endowment. Where the reward is purely consumptive (a one-off view), the pair does not apply.",
  "source": "Skinner variable-ratio schedules; Schultz Dayan & Montague 1997 doi:10.1126/science.275.5306.1593 (reward prediction error); Kahneman Knetsch & Thaler 1990 doi:10.1086/261737 (endowment). Interaction claim is inferred convergence."
}
