{
  "pair": [
    "EN-03",
    "ST-09"
  ],
  "type": "reinforcing",
  "fact": "Earned status is held as property, not merely enjoyed as position. Research on hierarchical loyalty programmes finds that customers treat an attained tier as something owned, with consequences that differ from never having held it — the standing is defended rather than simply pursued. Accumulated status therefore behaves as an endowment whose maintenance motivates continued participation, including continued payment.",
  "grade": "B-",
  "boundary": "Effect depends on the status being visibly earned rather than purchased outright; bought status is weaker property psychologically. Also depends on the hierarchy being credible and the standing being genuinely attained — inflated tiers where everyone is 'gold' confer neither status nor ownership.",
  "source": "Loyalty-programme status literature (customer tier attainment and defence); Kahneman Knetsch & Thaler 1990 doi:10.1086/261737; Festinger 1954 doi:10.1177/001872675400700202. Partially studied in the loyalty context, inferred for general product state."
}
